No.     Time                          Source                Destination           Protocol Length Info
    793 2017-11-28 14:58:00.311796    192.168.134.64        192.168.99.39         TCP      80     63134→8080 [SYN] Seq=0 Win=65535 Len=0 MSS=1460 WS=32 TSval=1451116284 TSecr=0 SACK_PERM=1

Frame 793: 80 bytes on wire (640 bits), 80 bytes captured (640 bits)
Linux cooked capture
Internet Protocol Version 4, Src: 192.168.134.64 (192.168.134.64), Dst: 192.168.99.39 (192.168.99.39)
Transmission Control Protocol, Src Port: 63134 (63134), Dst Port: 8080 (8080), Seq: 0, Len: 0

No.     Time                          Source                Destination           Protocol Length Info
    794 2017-11-28 14:58:00.311810    192.168.134.64        192.168.99.39         TCP      100    [TCP Out-Of-Order] 63134→8080 [SYN] Seq=0 Win=65535 Len=0 MSS=1460 WS=32 TSval=1451116284 TSecr=0 SACK_PERM=1

Frame 794: 100 bytes on wire (800 bits), 100 bytes captured (800 bits)
Linux cooked capture
Internet Protocol Version 4, Src: 10.1.0.180 (10.1.0.180), Dst: 10.1.0.179 (10.1.0.179)
Internet Protocol Version 4, Src: 192.168.134.64 (192.168.134.64), Dst: 192.168.99.39 (192.168.99.39)
Transmission Control Protocol, Src Port: 63134 (63134), Dst Port: 8080 (8080), Seq: 0, Len: 0

No.     Time                          Source                Destination           Protocol Length Info
    795 2017-11-28 14:58:00.312129    192.168.99.39         192.168.134.64        TCP      96     8080→63134 [SYN, ACK] Seq=0 Ack=1 Win=28960 Len=0 MSS=1460 SACK_PERM=1 TSval=40958459 TSecr=1451116284 WS=128

Frame 795: 96 bytes on wire (768 bits), 96 bytes captured (768 bits)
Linux cooked capture
Internet Protocol Version 4, Src: 10.1.0.179 (10.1.0.179), Dst: 10.1.0.180 (10.1.0.180)
Internet Protocol Version 4, Src: 192.168.99.39 (192.168.99.39), Dst: 192.168.134.64 (192.168.134.64)
Transmission Control Protocol, Src Port: 8080 (8080), Dst Port: 63134 (63134), Seq: 0, Ack: 1, Len: 0

No.     Time                          Source                Destination           Protocol Length Info
    796 2017-11-28 14:58:00.312144    192.168.99.39         192.168.134.64        TCP      76     [TCP Out-Of-Order] 8080→63134 [SYN, ACK] Seq=0 Ack=1 Win=28960 Len=0 MSS=1460 SACK_PERM=1 TSval=40958459 TSecr=1451116284 WS=128

Frame 796: 76 bytes on wire (608 bits), 76 bytes captured (608 bits)
Linux cooked capture
Internet Protocol Version 4, Src: 192.168.99.39 (192.168.99.39), Dst: 192.168.134.64 (192.168.134.64)
Transmission Control Protocol, Src Port: 8080 (8080), Dst Port: 63134 (63134), Seq: 0, Ack: 1, Len: 0

No.     Time                          Source                Destination           Protocol Length Info
    799 2017-11-28 14:58:00.312305    192.168.134.64        192.168.99.39         TCP      68     63134→8080 [ACK] Seq=1 Ack=1 Win=131744 Len=0 TSval=1451116284 TSecr=40958459

Frame 799: 68 bytes on wire (544 bits), 68 bytes captured (544 bits)
Linux cooked capture
Internet Protocol Version 4, Src: 192.168.134.64 (192.168.134.64), Dst: 192.168.99.39 (192.168.99.39)
Transmission Control Protocol, Src Port: 63134 (63134), Dst Port: 8080 (8080), Seq: 1, Ack: 1, Len: 0

No.     Time                          Source                Destination           Protocol Length Info
    800 2017-11-28 14:58:00.312312    192.168.134.64        192.168.99.39         TCP      88     [TCP Dup ACK 799#1] 63134→8080 [ACK] Seq=1 Ack=1 Win=131744 Len=0 TSval=1451116284 TSecr=40958459

Frame 800: 88 bytes on wire (704 bits), 88 bytes captured (704 bits)
Linux cooked capture
Internet Protocol Version 4, Src: 10.1.0.180 (10.1.0.180), Dst: 10.1.0.179 (10.1.0.179)
Internet Protocol Version 4, Src: 192.168.134.64 (192.168.134.64), Dst: 192.168.99.39 (192.168.99.39)
Transmission Control Protocol, Src Port: 63134 (63134), Dst Port: 8080 (8080), Seq: 1, Ack: 1, Len: 0

No.     Time                          Source                Destination           Protocol Length Info
    802 2017-11-28 14:58:00.312361    192.168.134.64        192.168.99.39         HTTP     142    GET / HTTP/1.1 

Frame 802: 142 bytes on wire (1136 bits), 142 bytes captured (1136 bits)
Linux cooked capture
Internet Protocol Version 4, Src: 192.168.134.64 (192.168.134.64), Dst: 192.168.99.39 (192.168.99.39)
Transmission Control Protocol, Src Port: 63134 (63134), Dst Port: 8080 (8080), Seq: 1, Ack: 1, Len: 74
Hypertext Transfer Protocol

No.     Time                          Source                Destination           Protocol Length Info
    803 2017-11-28 14:58:00.312365    192.168.134.64        192.168.99.39         TCP      162    [TCP Retransmission] 63134→8080 [PSH, ACK] Seq=1 Ack=1 Win=131744 Len=74 TSval=1451116284 TSecr=40958459

Frame 803: 162 bytes on wire (1296 bits), 162 bytes captured (1296 bits)
Linux cooked capture
Internet Protocol Version 4, Src: 10.1.0.180 (10.1.0.180), Dst: 10.1.0.179 (10.1.0.179)
Internet Protocol Version 4, Src: 192.168.134.64 (192.168.134.64), Dst: 192.168.99.39 (192.168.99.39)
Transmission Control Protocol, Src Port: 63134 (63134), Dst Port: 8080 (8080), Seq: 1, Ack: 1, Len: 74

No.     Time                          Source                Destination           Protocol Length Info
    804 2017-11-28 14:58:00.312641    192.168.99.39         192.168.134.64        TCP      88     8080→63134 [ACK] Seq=1 Ack=75 Win=29056 Len=0 TSval=40958460 TSecr=1451116284

Frame 804: 88 bytes on wire (704 bits), 88 bytes captured (704 bits)
Linux cooked capture
Internet Protocol Version 4, Src: 10.1.0.179 (10.1.0.179), Dst: 10.1.0.180 (10.1.0.180)
Internet Protocol Version 4, Src: 192.168.99.39 (192.168.99.39), Dst: 192.168.134.64 (192.168.134.64)
Transmission Control Protocol, Src Port: 8080 (8080), Dst Port: 63134 (63134), Seq: 1, Ack: 75, Len: 0

No.     Time                          Source                Destination           Protocol Length Info
    805 2017-11-28 14:58:00.312652    192.168.99.39         192.168.134.64        TCP      68     [TCP Dup ACK 804#1] 8080→63134 [ACK] Seq=1 Ack=75 Win=29056 Len=0 TSval=40958460 TSecr=1451116284

Frame 805: 68 bytes on wire (544 bits), 68 bytes captured (544 bits)
Linux cooked capture
Internet Protocol Version 4, Src: 192.168.99.39 (192.168.99.39), Dst: 192.168.134.64 (192.168.134.64)
Transmission Control Protocol, Src Port: 8080 (8080), Dst Port: 63134 (63134), Seq: 1, Ack: 75, Len: 0

No.     Time                          Source                Destination           Protocol Length Info
    807 2017-11-28 14:58:00.312873    192.168.99.39         192.168.134.64        HTTP     242    HTTP/1.1 200 OK  (text/plain)

Frame 807: 242 bytes on wire (1936 bits), 242 bytes captured (1936 bits)
Linux cooked capture
Internet Protocol Version 4, Src: 10.1.0.179 (10.1.0.179), Dst: 10.1.0.180 (10.1.0.180)
Internet Protocol Version 4, Src: 192.168.99.39 (192.168.99.39), Dst: 192.168.134.64 (192.168.134.64)
Transmission Control Protocol, Src Port: 8080 (8080), Dst Port: 63134 (63134), Seq: 1, Ack: 75, Len: 154
Hypertext Transfer Protocol
Line-based text data: text/plain

No.     Time                          Source                Destination           Protocol Length Info
    808 2017-11-28 14:58:00.312884    192.168.99.39         192.168.134.64        TCP      222    [TCP Retransmission] 8080→63134 [PSH, ACK] Seq=1 Ack=75 Win=29056 Len=154 TSval=40958460 TSecr=1451116284

Frame 808: 222 bytes on wire (1776 bits), 222 bytes captured (1776 bits)
Linux cooked capture
Internet Protocol Version 4, Src: 192.168.99.39 (192.168.99.39), Dst: 192.168.134.64 (192.168.134.64)
Transmission Control Protocol, Src Port: 8080 (8080), Dst Port: 63134 (63134), Seq: 1, Ack: 75, Len: 154

No.     Time                          Source                Destination           Protocol Length Info
    811 2017-11-28 14:58:00.312972    192.168.134.64        192.168.99.39         TCP      68     63134→8080 [ACK] Seq=75 Ack=155 Win=131584 Len=0 TSval=1451116285 TSecr=40958460

Frame 811: 68 bytes on wire (544 bits), 68 bytes captured (544 bits)
Linux cooked capture
Internet Protocol Version 4, Src: 192.168.134.64 (192.168.134.64), Dst: 192.168.99.39 (192.168.99.39)
Transmission Control Protocol, Src Port: 63134 (63134), Dst Port: 8080 (8080), Seq: 75, Ack: 155, Len: 0

No.     Time                          Source                Destination           Protocol Length Info
    812 2017-11-28 14:58:00.312978    192.168.134.64        192.168.99.39         TCP      88     [TCP Dup ACK 811#1] 63134→8080 [ACK] Seq=75 Ack=155 Win=131584 Len=0 TSval=1451116285 TSecr=40958460

Frame 812: 88 bytes on wire (704 bits), 88 bytes captured (704 bits)
Linux cooked capture
Internet Protocol Version 4, Src: 10.1.0.180 (10.1.0.180), Dst: 10.1.0.179 (10.1.0.179)
Internet Protocol Version 4, Src: 192.168.134.64 (192.168.134.64), Dst: 192.168.99.39 (192.168.99.39)
Transmission Control Protocol, Src Port: 63134 (63134), Dst Port: 8080 (8080), Seq: 75, Ack: 155, Len: 0

No.     Time                          Source                Destination           Protocol Length Info
    814 2017-11-28 14:58:00.313039    192.168.134.64        192.168.99.39         TCP      68     63134→8080 [FIN, ACK] Seq=75 Ack=155 Win=131584 Len=0 TSval=1451116285 TSecr=40958460

Frame 814: 68 bytes on wire (544 bits), 68 bytes captured (544 bits)
Linux cooked capture
Internet Protocol Version 4, Src: 192.168.134.64 (192.168.134.64), Dst: 192.168.99.39 (192.168.99.39)
Transmission Control Protocol, Src Port: 63134 (63134), Dst Port: 8080 (8080), Seq: 75, Ack: 155, Len: 0

No.     Time                          Source                Destination           Protocol Length Info
    815 2017-11-28 14:58:00.313044    192.168.134.64        192.168.99.39         TCP      88     [TCP Out-Of-Order] 63134→8080 [FIN, ACK] Seq=75 Ack=155 Win=131584 Len=0 TSval=1451116285 TSecr=40958460

Frame 815: 88 bytes on wire (704 bits), 88 bytes captured (704 bits)
Linux cooked capture
Internet Protocol Version 4, Src: 10.1.0.180 (10.1.0.180), Dst: 10.1.0.179 (10.1.0.179)
Internet Protocol Version 4, Src: 192.168.134.64 (192.168.134.64), Dst: 192.168.99.39 (192.168.99.39)
Transmission Control Protocol, Src Port: 63134 (63134), Dst Port: 8080 (8080), Seq: 75, Ack: 155, Len: 0

No.     Time                          Source                Destination           Protocol Length Info
    816 2017-11-28 14:58:00.313421    192.168.99.39         192.168.134.64        TCP      88     8080→63134 [FIN, ACK] Seq=155 Ack=76 Win=29056 Len=0 TSval=40958460 TSecr=1451116285

Frame 816: 88 bytes on wire (704 bits), 88 bytes captured (704 bits)
Linux cooked capture
Internet Protocol Version 4, Src: 10.1.0.179 (10.1.0.179), Dst: 10.1.0.180 (10.1.0.180)
Internet Protocol Version 4, Src: 192.168.99.39 (192.168.99.39), Dst: 192.168.134.64 (192.168.134.64)
Transmission Control Protocol, Src Port: 8080 (8080), Dst Port: 63134 (63134), Seq: 155, Ack: 76, Len: 0

No.     Time                          Source                Destination           Protocol Length Info
    817 2017-11-28 14:58:00.313434    192.168.99.39         192.168.134.64        TCP      68     [TCP Out-Of-Order] 8080→63134 [FIN, ACK] Seq=155 Ack=76 Win=29056 Len=0 TSval=40958460 TSecr=1451116285

Frame 817: 68 bytes on wire (544 bits), 68 bytes captured (544 bits)
Linux cooked capture
Internet Protocol Version 4, Src: 192.168.99.39 (192.168.99.39), Dst: 192.168.134.64 (192.168.134.64)
Transmission Control Protocol, Src Port: 8080 (8080), Dst Port: 63134 (63134), Seq: 155, Ack: 76, Len: 0

No.     Time                          Source                Destination           Protocol Length Info
    820 2017-11-28 14:58:00.313570    192.168.134.64        192.168.99.39         TCP      68     63134→8080 [ACK] Seq=76 Ack=156 Win=131584 Len=0 TSval=1451116285 TSecr=40958460

Frame 820: 68 bytes on wire (544 bits), 68 bytes captured (544 bits)
Linux cooked capture
Internet Protocol Version 4, Src: 192.168.134.64 (192.168.134.64), Dst: 192.168.99.39 (192.168.99.39)
Transmission Control Protocol, Src Port: 63134 (63134), Dst Port: 8080 (8080), Seq: 76, Ack: 156, Len: 0

No.     Time                          Source                Destination           Protocol Length Info
    821 2017-11-28 14:58:00.313576    192.168.134.64        192.168.99.39         TCP      88     [TCP Dup ACK 820#1] 63134→8080 [ACK] Seq=76 Ack=156 Win=131584 Len=0 TSval=1451116285 TSecr=40958460

Frame 821: 88 bytes on wire (704 bits), 88 bytes captured (704 bits)
Linux cooked capture
Internet Protocol Version 4, Src: 10.1.0.180 (10.1.0.180), Dst: 10.1.0.179 (10.1.0.179)
Internet Protocol Version 4, Src: 192.168.134.64 (192.168.134.64), Dst: 192.168.99.39 (192.168.99.39)
Transmission Control Protocol, Src Port: 63134 (63134), Dst Port: 8080 (8080), Seq: 76, Ack: 156, Len: 0
