No.     Time                          Source                Destination           Protocol Length Info
     21 2017-11-28 14:58:00.311909    192.168.134.64        192.168.99.39         TCP      100    63134→8080 [SYN] Seq=0 Win=65535 Len=0 MSS=1460 WS=32 TSval=1451116284 TSecr=0 SACK_PERM=1

Frame 21: 100 bytes on wire (800 bits), 100 bytes captured (800 bits)
Linux cooked capture
Internet Protocol Version 4, Src: 10.1.0.180 (10.1.0.180), Dst: 10.1.0.179 (10.1.0.179)
Internet Protocol Version 4, Src: 192.168.134.64 (192.168.134.64), Dst: 192.168.99.39 (192.168.99.39)
Transmission Control Protocol, Src Port: 63134 (63134), Dst Port: 8080 (8080), Seq: 0, Len: 0

No.     Time                          Source                Destination           Protocol Length Info
     22 2017-11-28 14:58:00.311945    192.168.134.64        192.168.99.39         TCP      80     [TCP Out-Of-Order] 63134→8080 [SYN] Seq=0 Win=65535 Len=0 MSS=1460 WS=32 TSval=1451116284 TSecr=0 SACK_PERM=1

Frame 22: 80 bytes on wire (640 bits), 80 bytes captured (640 bits)
Linux cooked capture
Internet Protocol Version 4, Src: 192.168.134.64 (192.168.134.64), Dst: 192.168.99.39 (192.168.99.39)
Transmission Control Protocol, Src Port: 63134 (63134), Dst Port: 8080 (8080), Seq: 0, Len: 0

No.     Time                          Source                Destination           Protocol Length Info
     23 2017-11-28 14:58:00.311981    192.168.134.64        192.168.99.39         TCP      80     [TCP Out-Of-Order] 63134→8080 [SYN] Seq=0 Win=65535 Len=0 MSS=1460 WS=32 TSval=1451116284 TSecr=0 SACK_PERM=1

Frame 23: 80 bytes on wire (640 bits), 80 bytes captured (640 bits)
Linux cooked capture
Internet Protocol Version 4, Src: 192.168.134.64 (192.168.134.64), Dst: 192.168.99.39 (192.168.99.39)
Transmission Control Protocol, Src Port: 63134 (63134), Dst Port: 8080 (8080), Seq: 0, Len: 0

No.     Time                          Source                Destination           Protocol Length Info
     24 2017-11-28 14:58:00.312016    192.168.99.39         192.168.134.64        TCP      76     8080→63134 [SYN, ACK] Seq=0 Ack=1 Win=28960 Len=0 MSS=1460 SACK_PERM=1 TSval=40958459 TSecr=1451116284 WS=128

Frame 24: 76 bytes on wire (608 bits), 76 bytes captured (608 bits)
Linux cooked capture
Internet Protocol Version 4, Src: 192.168.99.39 (192.168.99.39), Dst: 192.168.134.64 (192.168.134.64)
Transmission Control Protocol, Src Port: 8080 (8080), Dst Port: 63134 (63134), Seq: 0, Ack: 1, Len: 0

No.     Time                          Source                Destination           Protocol Length Info
     25 2017-11-28 14:58:00.312022    192.168.99.39         192.168.134.64        TCP      76     [TCP Out-Of-Order] 8080→63134 [SYN, ACK] Seq=0 Ack=1 Win=28960 Len=0 MSS=1460 SACK_PERM=1 TSval=40958459 TSecr=1451116284 WS=128

Frame 25: 76 bytes on wire (608 bits), 76 bytes captured (608 bits)
Linux cooked capture
Internet Protocol Version 4, Src: 192.168.99.39 (192.168.99.39), Dst: 192.168.134.64 (192.168.134.64)
Transmission Control Protocol, Src Port: 8080 (8080), Dst Port: 63134 (63134), Seq: 0, Ack: 1, Len: 0

No.     Time                          Source                Destination           Protocol Length Info
     26 2017-11-28 14:58:00.312031    192.168.99.39         192.168.134.64        TCP      96     [TCP Out-Of-Order] 8080→63134 [SYN, ACK] Seq=0 Ack=1 Win=28960 Len=0 MSS=1460 SACK_PERM=1 TSval=40958459 TSecr=1451116284 WS=128

Frame 26: 96 bytes on wire (768 bits), 96 bytes captured (768 bits)
Linux cooked capture
Internet Protocol Version 4, Src: 10.1.0.179 (10.1.0.179), Dst: 10.1.0.180 (10.1.0.180)
Internet Protocol Version 4, Src: 192.168.99.39 (192.168.99.39), Dst: 192.168.134.64 (192.168.134.64)
Transmission Control Protocol, Src Port: 8080 (8080), Dst Port: 63134 (63134), Seq: 0, Ack: 1, Len: 0

No.     Time                          Source                Destination           Protocol Length Info
     27 2017-11-28 14:58:00.312439    192.168.134.64        192.168.99.39         TCP      88     63134→8080 [ACK] Seq=1 Ack=1 Win=131744 Len=0 TSval=1451116284 TSecr=40958459

Frame 27: 88 bytes on wire (704 bits), 88 bytes captured (704 bits)
Linux cooked capture
Internet Protocol Version 4, Src: 10.1.0.180 (10.1.0.180), Dst: 10.1.0.179 (10.1.0.179)
Internet Protocol Version 4, Src: 192.168.134.64 (192.168.134.64), Dst: 192.168.99.39 (192.168.99.39)
Transmission Control Protocol, Src Port: 63134 (63134), Dst Port: 8080 (8080), Seq: 1, Ack: 1, Len: 0

No.     Time                          Source                Destination           Protocol Length Info
     28 2017-11-28 14:58:00.312454    192.168.134.64        192.168.99.39         HTTP     162    GET / HTTP/1.1 

Frame 28: 162 bytes on wire (1296 bits), 162 bytes captured (1296 bits)
Linux cooked capture
Internet Protocol Version 4, Src: 10.1.0.180 (10.1.0.180), Dst: 10.1.0.179 (10.1.0.179)
Internet Protocol Version 4, Src: 192.168.134.64 (192.168.134.64), Dst: 192.168.99.39 (192.168.99.39)
Transmission Control Protocol, Src Port: 63134 (63134), Dst Port: 8080 (8080), Seq: 1, Ack: 1, Len: 74
Hypertext Transfer Protocol

No.     Time                          Source                Destination           Protocol Length Info
     29 2017-11-28 14:58:00.312462    192.168.134.64        192.168.99.39         TCP      68     63134→8080 [ACK] Seq=1 Ack=1 Win=131744 Len=0 TSval=1451116284 TSecr=40958459

Frame 29: 68 bytes on wire (544 bits), 68 bytes captured (544 bits)
Linux cooked capture
Internet Protocol Version 4, Src: 192.168.134.64 (192.168.134.64), Dst: 192.168.99.39 (192.168.99.39)
Transmission Control Protocol, Src Port: 63134 (63134), Dst Port: 8080 (8080), Seq: 1, Ack: 1, Len: 0

No.     Time                          Source                Destination           Protocol Length Info
     30 2017-11-28 14:58:00.312472    192.168.134.64        192.168.99.39         TCP      68     63134→8080 [ACK] Seq=1 Ack=1 Win=131744 Len=0 TSval=1451116284 TSecr=40958459

Frame 30: 68 bytes on wire (544 bits), 68 bytes captured (544 bits)
Linux cooked capture
Internet Protocol Version 4, Src: 192.168.134.64 (192.168.134.64), Dst: 192.168.99.39 (192.168.99.39)
Transmission Control Protocol, Src Port: 63134 (63134), Dst Port: 8080 (8080), Seq: 1, Ack: 1, Len: 0

No.     Time                          Source                Destination           Protocol Length Info
     31 2017-11-28 14:58:00.312473    192.168.134.64        192.168.99.39         TCP      142    [TCP Retransmission] 63134→8080 [PSH, ACK] Seq=1 Ack=1 Win=131744 Len=74 TSval=1451116284 TSecr=40958459

Frame 31: 142 bytes on wire (1136 bits), 142 bytes captured (1136 bits)
Linux cooked capture
Internet Protocol Version 4, Src: 192.168.134.64 (192.168.134.64), Dst: 192.168.99.39 (192.168.99.39)
Transmission Control Protocol, Src Port: 63134 (63134), Dst Port: 8080 (8080), Seq: 1, Ack: 1, Len: 74

No.     Time                          Source                Destination           Protocol Length Info
     32 2017-11-28 14:58:00.312476    192.168.134.64        192.168.99.39         TCP      142    [TCP Retransmission] 63134→8080 [PSH, ACK] Seq=1 Ack=1 Win=131744 Len=74 TSval=1451116284 TSecr=40958459

Frame 32: 142 bytes on wire (1136 bits), 142 bytes captured (1136 bits)
Linux cooked capture
Internet Protocol Version 4, Src: 192.168.134.64 (192.168.134.64), Dst: 192.168.99.39 (192.168.99.39)
Transmission Control Protocol, Src Port: 63134 (63134), Dst Port: 8080 (8080), Seq: 1, Ack: 1, Len: 74

No.     Time                          Source                Destination           Protocol Length Info
     33 2017-11-28 14:58:00.312539    192.168.99.39         192.168.134.64        TCP      68     8080→63134 [ACK] Seq=1 Ack=75 Win=29056 Len=0 TSval=40958460 TSecr=1451116284

Frame 33: 68 bytes on wire (544 bits), 68 bytes captured (544 bits)
Linux cooked capture
Internet Protocol Version 4, Src: 192.168.99.39 (192.168.99.39), Dst: 192.168.134.64 (192.168.134.64)
Transmission Control Protocol, Src Port: 8080 (8080), Dst Port: 63134 (63134), Seq: 1, Ack: 75, Len: 0

No.     Time                          Source                Destination           Protocol Length Info
     34 2017-11-28 14:58:00.312547    192.168.99.39         192.168.134.64        TCP      68     [TCP Dup ACK 33#1] 8080→63134 [ACK] Seq=1 Ack=75 Win=29056 Len=0 TSval=40958460 TSecr=1451116284

Frame 34: 68 bytes on wire (544 bits), 68 bytes captured (544 bits)
Linux cooked capture
Internet Protocol Version 4, Src: 192.168.99.39 (192.168.99.39), Dst: 192.168.134.64 (192.168.134.64)
Transmission Control Protocol, Src Port: 8080 (8080), Dst Port: 63134 (63134), Seq: 1, Ack: 75, Len: 0

No.     Time                          Source                Destination           Protocol Length Info
     35 2017-11-28 14:58:00.312553    192.168.99.39         192.168.134.64        TCP      88     [TCP Dup ACK 33#2] 8080→63134 [ACK] Seq=1 Ack=75 Win=29056 Len=0 TSval=40958460 TSecr=1451116284

Frame 35: 88 bytes on wire (704 bits), 88 bytes captured (704 bits)
Linux cooked capture
Internet Protocol Version 4, Src: 10.1.0.179 (10.1.0.179), Dst: 10.1.0.180 (10.1.0.180)
Internet Protocol Version 4, Src: 192.168.99.39 (192.168.99.39), Dst: 192.168.134.64 (192.168.134.64)
Transmission Control Protocol, Src Port: 8080 (8080), Dst Port: 63134 (63134), Seq: 1, Ack: 75, Len: 0

No.     Time                          Source                Destination           Protocol Length Info
     36 2017-11-28 14:58:00.312763    192.168.99.39         192.168.134.64        HTTP     222    HTTP/1.1 200 OK  (text/plain)

Frame 36: 222 bytes on wire (1776 bits), 222 bytes captured (1776 bits)
Linux cooked capture
Internet Protocol Version 4, Src: 192.168.99.39 (192.168.99.39), Dst: 192.168.134.64 (192.168.134.64)
Transmission Control Protocol, Src Port: 8080 (8080), Dst Port: 63134 (63134), Seq: 1, Ack: 75, Len: 154
Hypertext Transfer Protocol
Line-based text data: text/plain

No.     Time                          Source                Destination           Protocol Length Info
     37 2017-11-28 14:58:00.312772    192.168.99.39         192.168.134.64        TCP      222    [TCP Retransmission] 8080→63134 [PSH, ACK] Seq=1 Ack=75 Win=29056 Len=154 TSval=40958460 TSecr=1451116284

Frame 37: 222 bytes on wire (1776 bits), 222 bytes captured (1776 bits)
Linux cooked capture
Internet Protocol Version 4, Src: 192.168.99.39 (192.168.99.39), Dst: 192.168.134.64 (192.168.134.64)
Transmission Control Protocol, Src Port: 8080 (8080), Dst Port: 63134 (63134), Seq: 1, Ack: 75, Len: 154

No.     Time                          Source                Destination           Protocol Length Info
     38 2017-11-28 14:58:00.312778    192.168.99.39         192.168.134.64        TCP      242    [TCP Retransmission] 8080→63134 [PSH, ACK] Seq=1 Ack=75 Win=29056 Len=154 TSval=40958460 TSecr=1451116284

Frame 38: 242 bytes on wire (1936 bits), 242 bytes captured (1936 bits)
Linux cooked capture
Internet Protocol Version 4, Src: 10.1.0.179 (10.1.0.179), Dst: 10.1.0.180 (10.1.0.180)
Internet Protocol Version 4, Src: 192.168.99.39 (192.168.99.39), Dst: 192.168.134.64 (192.168.134.64)
Transmission Control Protocol, Src Port: 8080 (8080), Dst Port: 63134 (63134), Seq: 1, Ack: 75, Len: 154

No.     Time                          Source                Destination           Protocol Length Info
     39 2017-11-28 14:58:00.313148    192.168.134.64        192.168.99.39         TCP      88     63134→8080 [ACK] Seq=75 Ack=155 Win=131584 Len=0 TSval=1451116285 TSecr=40958460

Frame 39: 88 bytes on wire (704 bits), 88 bytes captured (704 bits)
Linux cooked capture
Internet Protocol Version 4, Src: 10.1.0.180 (10.1.0.180), Dst: 10.1.0.179 (10.1.0.179)
Internet Protocol Version 4, Src: 192.168.134.64 (192.168.134.64), Dst: 192.168.99.39 (192.168.99.39)
Transmission Control Protocol, Src Port: 63134 (63134), Dst Port: 8080 (8080), Seq: 75, Ack: 155, Len: 0

No.     Time                          Source                Destination           Protocol Length Info
     40 2017-11-28 14:58:00.313180    192.168.134.64        192.168.99.39         TCP      88     63134→8080 [FIN, ACK] Seq=75 Ack=155 Win=131584 Len=0 TSval=1451116285 TSecr=40958460

Frame 40: 88 bytes on wire (704 bits), 88 bytes captured (704 bits)
Linux cooked capture
Internet Protocol Version 4, Src: 10.1.0.180 (10.1.0.180), Dst: 10.1.0.179 (10.1.0.179)
Internet Protocol Version 4, Src: 192.168.134.64 (192.168.134.64), Dst: 192.168.99.39 (192.168.99.39)
Transmission Control Protocol, Src Port: 63134 (63134), Dst Port: 8080 (8080), Seq: 75, Ack: 155, Len: 0

No.     Time                          Source                Destination           Protocol Length Info
     41 2017-11-28 14:58:00.313191    192.168.134.64        192.168.99.39         TCP      68     [TCP Keep-Alive] 63134→8080 [ACK] Seq=75 Ack=155 Win=131584 Len=0 TSval=1451116285 TSecr=40958460

Frame 41: 68 bytes on wire (544 bits), 68 bytes captured (544 bits)
Linux cooked capture
Internet Protocol Version 4, Src: 192.168.134.64 (192.168.134.64), Dst: 192.168.99.39 (192.168.99.39)
Transmission Control Protocol, Src Port: 63134 (63134), Dst Port: 8080 (8080), Seq: 75, Ack: 155, Len: 0

No.     Time                          Source                Destination           Protocol Length Info
     42 2017-11-28 14:58:00.313203    192.168.134.64        192.168.99.39         TCP      68     [TCP Keep-Alive] 63134→8080 [ACK] Seq=75 Ack=155 Win=131584 Len=0 TSval=1451116285 TSecr=40958460

Frame 42: 68 bytes on wire (544 bits), 68 bytes captured (544 bits)
Linux cooked capture
Internet Protocol Version 4, Src: 192.168.134.64 (192.168.134.64), Dst: 192.168.99.39 (192.168.99.39)
Transmission Control Protocol, Src Port: 63134 (63134), Dst Port: 8080 (8080), Seq: 75, Ack: 155, Len: 0

No.     Time                          Source                Destination           Protocol Length Info
     43 2017-11-28 14:58:00.313219    192.168.134.64        192.168.99.39         TCP      68     [TCP Out-Of-Order] 63134→8080 [FIN, ACK] Seq=75 Ack=155 Win=131584 Len=0 TSval=1451116285 TSecr=40958460

Frame 43: 68 bytes on wire (544 bits), 68 bytes captured (544 bits)
Linux cooked capture
Internet Protocol Version 4, Src: 192.168.134.64 (192.168.134.64), Dst: 192.168.99.39 (192.168.99.39)
Transmission Control Protocol, Src Port: 63134 (63134), Dst Port: 8080 (8080), Seq: 75, Ack: 155, Len: 0

No.     Time                          Source                Destination           Protocol Length Info
     44 2017-11-28 14:58:00.313229    192.168.134.64        192.168.99.39         TCP      68     [TCP Out-Of-Order] 63134→8080 [FIN, ACK] Seq=75 Ack=155 Win=131584 Len=0 TSval=1451116285 TSecr=40958460

Frame 44: 68 bytes on wire (544 bits), 68 bytes captured (544 bits)
Linux cooked capture
Internet Protocol Version 4, Src: 192.168.134.64 (192.168.134.64), Dst: 192.168.99.39 (192.168.99.39)
Transmission Control Protocol, Src Port: 63134 (63134), Dst Port: 8080 (8080), Seq: 75, Ack: 155, Len: 0

No.     Time                          Source                Destination           Protocol Length Info
     45 2017-11-28 14:58:00.313301    192.168.99.39         192.168.134.64        TCP      68     8080→63134 [FIN, ACK] Seq=155 Ack=76 Win=29056 Len=0 TSval=40958460 TSecr=1451116285

Frame 45: 68 bytes on wire (544 bits), 68 bytes captured (544 bits)
Linux cooked capture
Internet Protocol Version 4, Src: 192.168.99.39 (192.168.99.39), Dst: 192.168.134.64 (192.168.134.64)
Transmission Control Protocol, Src Port: 8080 (8080), Dst Port: 63134 (63134), Seq: 155, Ack: 76, Len: 0

No.     Time                          Source                Destination           Protocol Length Info
     46 2017-11-28 14:58:00.313312    192.168.99.39         192.168.134.64        TCP      68     [TCP Out-Of-Order] 8080→63134 [FIN, ACK] Seq=155 Ack=76 Win=29056 Len=0 TSval=40958460 TSecr=1451116285

Frame 46: 68 bytes on wire (544 bits), 68 bytes captured (544 bits)
Linux cooked capture
Internet Protocol Version 4, Src: 192.168.99.39 (192.168.99.39), Dst: 192.168.134.64 (192.168.134.64)
Transmission Control Protocol, Src Port: 8080 (8080), Dst Port: 63134 (63134), Seq: 155, Ack: 76, Len: 0

No.     Time                          Source                Destination           Protocol Length Info
     47 2017-11-28 14:58:00.313320    192.168.99.39         192.168.134.64        TCP      88     [TCP Out-Of-Order] 8080→63134 [FIN, ACK] Seq=155 Ack=76 Win=29056 Len=0 TSval=40958460 TSecr=1451116285

Frame 47: 88 bytes on wire (704 bits), 88 bytes captured (704 bits)
Linux cooked capture
Internet Protocol Version 4, Src: 10.1.0.179 (10.1.0.179), Dst: 10.1.0.180 (10.1.0.180)
Internet Protocol Version 4, Src: 192.168.99.39 (192.168.99.39), Dst: 192.168.134.64 (192.168.134.64)
Transmission Control Protocol, Src Port: 8080 (8080), Dst Port: 63134 (63134), Seq: 155, Ack: 76, Len: 0

No.     Time                          Source                Destination           Protocol Length Info
     48 2017-11-28 14:58:00.313675    192.168.134.64        192.168.99.39         TCP      88     63134→8080 [ACK] Seq=76 Ack=156 Win=131584 Len=0 TSval=1451116285 TSecr=40958460

Frame 48: 88 bytes on wire (704 bits), 88 bytes captured (704 bits)
Linux cooked capture
Internet Protocol Version 4, Src: 10.1.0.180 (10.1.0.180), Dst: 10.1.0.179 (10.1.0.179)
Internet Protocol Version 4, Src: 192.168.134.64 (192.168.134.64), Dst: 192.168.99.39 (192.168.99.39)
Transmission Control Protocol, Src Port: 63134 (63134), Dst Port: 8080 (8080), Seq: 76, Ack: 156, Len: 0

No.     Time                          Source                Destination           Protocol Length Info
     49 2017-11-28 14:58:00.313690    192.168.134.64        192.168.99.39         TCP      68     [TCP Dup ACK 48#1] 63134→8080 [ACK] Seq=76 Ack=156 Win=131584 Len=0 TSval=1451116285 TSecr=40958460

Frame 49: 68 bytes on wire (544 bits), 68 bytes captured (544 bits)
Linux cooked capture
Internet Protocol Version 4, Src: 192.168.134.64 (192.168.134.64), Dst: 192.168.99.39 (192.168.99.39)
Transmission Control Protocol, Src Port: 63134 (63134), Dst Port: 8080 (8080), Seq: 76, Ack: 156, Len: 0

No.     Time                          Source                Destination           Protocol Length Info
     50 2017-11-28 14:58:00.313700    192.168.134.64        192.168.99.39         TCP      68     [TCP Dup ACK 48#2] 63134→8080 [ACK] Seq=76 Ack=156 Win=131584 Len=0 TSval=1451116285 TSecr=40958460

Frame 50: 68 bytes on wire (544 bits), 68 bytes captured (544 bits)
Linux cooked capture
Internet Protocol Version 4, Src: 192.168.134.64 (192.168.134.64), Dst: 192.168.99.39 (192.168.99.39)
Transmission Control Protocol, Src Port: 63134 (63134), Dst Port: 8080 (8080), Seq: 76, Ack: 156, Len: 0
